198,น้ำตกโตนงาช้าง,5,น้ำตก,ทุ่งตำเสา,หาดใหญ่,สงขลา,ใต้,6.946624,100.231933,ทัศนียภาพสวยงามเป็นแหล่งท่องเที่ยวที่สำคัญ,เป็นน้ำตกที่เกิดจากเทือกเขาบรรทัด มีความสูงมาก มีป่าสมบูรณ์ เป็นน้ำตกขนาดใหญ่ที่สวยงาม มีทั้งหมด 7 ชั้น แต่ละชั้นมีชื่อต่างกันไป ชั้นที่สวยที่สุดคือชั้น 3 ซึ่งมีชื่อว่าโตนงาช้างเหมือนชื่อน้ำตก สูงประมาณ 150 เมตร แยกเป็นสองแพร่ง สีขาวคล้ายงาช้าง บริเวณต้นน้ำตกเป็นป่าดิบชื้น อุดมสมบุรณ์ ยังไม่ถูกทำลาย ทำให้มีน้ำตกตลอดทั้งปี
199,น้ำตกบริพัตร,5,น้ำตก,เขาพระ,รัตภูมิ,สงขลา,ใต้,6.994515,100.149534,ทัศนียภาพสวยงามเป็นแหล่งท่องเที่ยวที่สำคัญ,เป็นน้ำตกที่เกิดจากเทือกเขาบรรทัดที่สูงและมีป่าสมบูรณ์ หายากและสวยงาม มีทั้งหมด 7 ชั้น จุดเด่นของน้ำตกเเห่งนี้ คือ สามารถมองเห็นทรายสีขาวบริสุทธิ์อยู่ใต้พื้นน้ำ และบริเวณชั้นที่ 5 มีธารน้ำตกที่ไหลลงมาจากช่องโขดหินเมื่อโดนแสงแดดและลมพัดกระเซ็นเห็นละอองน้ำอย่างสวยงาม
200,ทะเลสาบสงขลา,7,แหล่งน้ำ,ควนขนุน,เมืองสงขลา,สงขลา,ใต้,7.17272,100.532227,เป็นทะเลสาบขนาดใหญ่ทัศนียภาพสวยงาม เป็นแหล่งท่องเที่ยวที่สำคัญของจังหวัด,เป็นทะเลสาบที่เกิดจากโครงสร้างทางธรรมชาติที่มีหนึ่งเดียว หายากและสวยงาม เป็นทะเลสาบน้ำเค็มขนาดใหญ่ เกิดขึ้นระหว่างแผ่นดินใหญ่แนวสันทราย น้ำเชื่อมต่อกับทะเลหลวง มีความยาวจากปากแม่น้ำไปทางทิศเหนือประมาณ 80 กิโลเมตร น้ำในทะเลสาบจะมีความเค็ม ขึ้นอยู่กับการขึ้นลงของน้ำทะเล
201,อุทยานนกน้ำคูขุด,7,แหล่งน้ำ,คูขุด,สทิงพระ,สงขลา,ใต้,7.406111,100.386667,เป็นที่อยู่อาศัยของนกน้ำจำนวนมาก,เป็นหนองน้ำที่เกิดจากโครงสร้างทางธรรมชาติ ที่หายากและสวยงาม เป็นที่อยู่อาศัยของนกน้ำจำนวนมาก อุทยานนกน้ำคูขุดนี้เป็นส่วนหนึ่งของทะเลสาบสงขลา ซึ่งมีอาหารอุดมสมบูรณ์
202,หาดปากบางสะกอม,8,ชายหาด,สะกอม,เทพา,สงขลา,ใต้,6.95901,100.842051,ทัศนียภาพสวยงามเป็นแหล่งท่องเที่ยวที่สำคัญ,เป็นชายหาดที่เกิดจากมีโครงการสร้างทางธรรมชาติที่ดี หายากและสวยงาม มีต้นสนขึ้นตลอดแนวชายหาด มีชุมชนและเป็นแหล่งท่องเที่ยวของท้องถิ่นเหมาะแก่การพักผ่อน
203,หาดสมิหลา,8,ชายหาด,บ่อยาง,เมืองสงขลา,สงขลา,ใต้,7.214444,100.595278,ทัศนียภาพสวยงามเป็นแหล่งท่องเที่ยวที่สำคัญของจังหวัด,"เป็นชายหาดที่มีโครงสร้างทางธรมมชาติที่ดี สวยงาม มีโขดหินขนาดย่อมยื่นลงทะเล หาดทรายขาวละเอียดมาก ที่เรียกว่า ""หาดทรายแก้ว"" มีป่าสนร่มรื่น จากหาดสมิหลา สามารถมองเห็นทิวทัศน์อันงดงามของเกาะหนูเกาะแมว บริเวณหาดมีรูปปั้น นางเงือกทอง โดยรอบบริเวณได้จัดสวนหย่อมไว้ ดูร่มรื่น หาดสมิหลาเป็นชายหาดที่มีบรรยากาศสงบ เหมาะสำหรับมาพักผ่อนชมวิว"
204,หาดเก้าเส้ง,8,ชายหาด,บ่อยาง,เมืองสงขลา,สงขลา,ใต้,7.180833,100.623333,ทัศนียภาพสวยงามเป็นแหล่งท่องเที่ยวที่สำคัญ,เป็นชายหาดที่ยาวมาจากหาดสมิหลา ไปทางทิศใต้ฝั่งอ่าวไทย ด้านใต้จะมีภูเขายื่นลงไปในทะเล ตรงปลายภูเขาจะมีหินก้อนใหญ่วางอยู่ เป็นสัญลักษณ์ของบริเวณนี้ หินก้อนที่วางตั้งเด่นอยู่เหนือโขดหิน ชาวบ้านเรียกว่า หัวนายเเรง หาดแห่งนี้เป็นที่ที่ชาวบ้านยังนิยมทำประมง มีเรือประมงจอดอยู่บริเวณชายหาดเป็นประจำ
205,หาดม่วงงาม,8,ชายหาด,ม่วงงาม,สิงหนคร,สงขลา,ใต้,7.353056,100.490556,ทัศนียภาพสวยงามเป็นแหล่งท่องเที่ยวที่สำคัญ,"เป็นชายหาดที่เกิดจากโครงสร้างทางธรรมชาติที่หายากและสวยงาม เป็นหาดทรายขาวละเอียด ยาวประมาณ 3 กิโลเมตร มีต้นมะพร้าวและต้นสนขึ้นตลอดแนวชายหาด คำว่า ""ม่วงงาม"" มาจากชื่อต้นไม้ชนิดหนึ่ง มีดอกสีม่วงขึ้นอยู่มากบริเวณนี้ จึงเรียกว่า ""ม่วงงาม"""
206,แหลมสนอ่อน,8,ชายหาด,บ่อยาง,เมืองสงขลา,สงขลา,ใต้,7.226944,100.576944,ทัศนียภาพสวยงามเป็นที่ประดิษฐานอนุสาวรีย์กรมหลวงชุมพรเขตอุดมศักดิ์,"เป็นเเหลมที่งอกต่อจากแผ่นใหญ่ ขนานไปกับแม่น้ำทับถมนับร้อยปี เกิดจากโครงสร้างทางธรรมชาติที่หายากและสวยงาม อยู่บริเวณแหลมสมิหลา ร่มรื่นไปด้วยทิวสนทะเลที่ขึ้นทั่วไปของแหลมแห่งนี้ จึงได้ชื่อว่า ""แหลมสนอ่อน"""
207,น้ำตกทรายขาว,5,น้ำตก,ทรายขาว,โคกโพธิ์,ปัตตานี,ใต้,6.656769,101.096061,ทัศนียภาพสวยงามเป็นแหล่งท่องเที่ยวที่สำคัญ,อยู่ในอุทยานแห่งชาติน้ำตกทรายขาว เป็นน้ำตกที่มีน้ำไหลผ่านซอกหินสูง มีความสวยงามและหายาก สภาพพื้นที่โดยรอบเป็นป่าดิบชื้นที่อุดมสมบูรณ์ไปด้วยพรรณไม้และสัตว์ป่านานาชนิด
208,หาดรัชดาภิเษก (หาดสายหมอ),8,ชายหาด,บางเขา,หนองจิก,ปัตตานี,ใต้,6.859617,101.137958,ทัศนียภาพสวยงามเป็นแหล่งท่องเที่ยวที่สำคัญ,เป็นหาดที่เกิดจากโครงสร้างทางธรรมชาติที่หายากและสวยงาม เป็นหาดที่มีทรายละเอียดตามแนวชายฝั่ง เป็นที่ตั้งของหมู่บ้านชาวประมง เดิมเป็นที่จอดเรือของชาวประมง จึงชื่อว่าบ้านสายหมอ และได้พัฒนาเป็นแหล่งท่องเที่ยว
209,หาดแฆแฆ,8,ชายหาด,น้ำบ่อ,ปะนาเระ,ปัตตานี,ใต้,6.845556,101.5525,เป็นชายหาดที่เกิดจากโขดหินแกรนิตที่ชายหาดทัศนียภาพสวยงาม เป็นแหล่งท่องเที่ยวที่สำคัญ,เป็นชายหาดซึ่งมีความสวยงามและน่าเที่ยวที่สุดแห่งหนึ่งของจังหวัดปัตตานี จุดเด่นของหาดแห่งนี้ คือ เป็นชายหาดที่มีโขดหินแกรนิตขนาดใหญ่ ลักษณะแปลกตาสวยงามบนเนินเขา และมีก้อนหินกระจายอยู่บริเวณรอบชายหาด และมีทรายละเอียดสวยงาม
210,หาดชลาลัย,8,ชายหาด,ปะนาเระ,ปะนาเระ,ปัตตานี,ใต้,6.8725,101.489167,ทัศนียภาพสวยงามเป็นแหล่งท่องเที่ยวที่สำคัญ,เป็นหาดทรายที่เกิดจากโครงสร้างทางธรรมชาติที่หายากและสวยงาม โดยการกระทำของคลื่นที่พัดเอาทรายขึ้นมาทับถมทุกปี มีทรายขาวละเอียด ยาวประมาณ 2 กิโลเมตร ตรงกลางมีแอ่งน้ำธรรมชาติที่กั้นด้วยทรายที่ถูกพัดขึ้นมาเเต่ละปี จะมีคลื่นแรงในบางฤดู ตลอดเเนวชายหาดมีต้นสนร่มรื่นสวยงาม
211,หาดตะโละกาโปร์,8,ชายหาด,ตะโละกาโปร์,ยะหริ่ง,ปัตตานี,ใต้,6.898889,101.371389,ทัศนียภาพสวยงามเป็นแหล่งท่องเที่ยวที่สำคัญ,เป็นหาดทรายขาวสะอาด ขนานกับชายฝั่งทะเล มีเรือกอและของชาวประมงจอดอยู่เป็นจำนวนมาก หาดทรายแห่งนี้ทอดยาวออกไปเรื่อย ๆ เพราะเกิดจากกระแสลมพัดเอาตะกอนทรายมาทับถมพอกพูน เหมาะแก่การไปนั่งพักผ่อนชมธรรมชาติ
212,แหลมตาชี (แหลมโพธิ์),8,ชายหาด,แหลมโพธิ์,ยะหริ่ง,ปัตตานี,ใต้,6.935833,101.240556,ทัศนียภาพสวยงามเป็นเอกลักษณ์ของท้องถิ่น,เป็นหาดทรายขาวต่อจากหาดตะโละกาโปร์ โดยลักษณะเด่นของหาดนี้ คือ เป็นหาดที่มีจะงอยของสันดอนที่งอกออกสู่ทะเล เกิดจากสันดอนทรายที่ทับถมเป็นเวลานานระหว่างปากแม่น้ำปัตตานีและทะเลฝั่งอันดามัน ส่วนที่งอกเป็นชายหาดยาวผสมกับเเนวทิวสนยาว เป็นสัญลักษณ์ของอ่าวปัตตานีมองเห็นได้จากระยะไกล
213,ถ้ำคูหาภิมุข,4,ถ้ำ,หน้าถ้ำ,เมืองยะลา,ยะลา,ใต้,6.527222,101.223611,เป็นสถานที่ศักดิ์สิทธิ์ที่มีประโยชน์ทางโบราณคดี,เป็นถ้ำที่เกิดจากโครงสร้างทางธรรมชาติที่หายาก และสวยงาม เป็นที่ตั้งของวัดคูหาภิมุข บริเวณโดยรอบถ้ำมีบรรยากาศร่มรื่น เหมาะเเก่การไปท่องเที่ยวเเละสักการะสิ่งศักดิ์สิทธิ์เพื่อความเป็นสิริมงคล
214,ถ้ำกระแซง,4,ถ้ำ,บันนังสตา,บันนังสตา,ยะลา,ใต้,6.213939,101.204051,เป็นเอกลักษณ์ของท้องถิ่น,เป็นถ้ำที่เกิดจากภูเขาสูง มีลำธารผ่านทะลุภูเขาเกิดเป็นถ้ำสูงประมาณ 50 เมตร บริเวณปากถ้ำเปิดกว้างประมาณ 25 เมตร เพดานถ้ำมีหินงอกหินย้อย มีธารน้ำและถ้ำลอดที่สวยงาม ในช่วงที่น้ำน้อยสามารถเดินเลาะเลียบตามลำธารลอดถ้ำไปทะลุอีกด้านหนึ่ง ซึ่งเป็นที่โล่ง โอบล้อมด้วยภูเขา เเละป่าที่อุดมสมบูรณ์ มีทัศนียภาพสวยงาม
215,น้ำตกสุขทาลัย (น้ำตกกือลอง),5,น้ำตก,ตลิ่งชัน,บันนังสตา,ยะลา,ใต้,6.316389,101.358333,ทัศนียภาพสวยงามเป็นเอกลักษณ์ของท้องถิ่น,เป็นน้ำตกที่เกิดจากป่าดิบชื้นและภูเขาสูง ที่หายากและสวยงาม มีทั้งหมด 5 ชั้น โดยเฉพาะชั้นที่ 3 ที่มีน้ำไหลเเละสามารถลงเล่นน้ำได้ นอกจากนี้ยังเป็นที่ตั้งของตำหนักสมเด็จพระศรีนครินทราบรมราชชนี ในโอกาสที่เสด็จมาทรงปฏิบัติภารกิจในจังหวัดยะลา
216,น้ำตกธารโต,5,น้ำตก,ถ้ำทะลุ,บันนังสตา,ยะลา,ใต้,6.221312,101.158804,ทัศนียภาพสวยงามเป็นแหล่งท่องเที่ยวที่สำคัญ,เป็นน้ำตกที่เกิดจากภูเขาสูง มีป่าดิบชื้นสมบูรณ์ หายากและสวยงาม เป็นน้ำตกขนาดใหญ่ สูงทั้งหมด 9 ชั้น ต้นน้ำเกิดจากภูเขาชายเเดนมาเลเซีย มีน้ำตลอดทั้งปี สภาพป่าดงดิบเป็นที่อยู่อาศัยของนก อาทิ นกกาฮัง และนกเงือก เนื่องจากมีต้นไม้ใหญ่อยู่มาก
217,น้ำตกละอองรุ้ง,5,น้ำตก,แม่หวาด,ธารโต,ยะลา,ใต้,5.997393,101.186661,ทัศนียภาพสวยงามเป็นแหล่งท่องเที่ยวที่สำคัญ,"เป็นน้ำตกที่เกิดจากภูเขาสูง เป็นธรรมชาติที่ดี หายากและสวยงาม น้ำตกมีความสูงประมาณ 20 เมตร ตกจากหน้าผา น้ำจะไหลแรงตกสู่เบื้องล่าง เกิดเป็นละอองน้ำกระจายเมื่อกระทบเเสงเเดดจะเหมือนรุ้งกินน้ำอย่างสวยงาม จึงได้ชื่อว่า ""น้ำตกละอองรุ้ง"""
218,ถ้ำโต๊ะโม๊ะ,4,ถ้ำ,ภูเขาทอง,สุคิริน,นราธิวาส,ใต้,5.801944,101.710556,เป็นถ้ำที่มีการทำเหมืองทองคำในประเทศไทยมีประโยชน์ในด้านการศึกษาค้นคว้าทางภูมิศาสตร์,เป็นถ้ำที่มีความสำคัญทางประวัติศาสตร์ที่มีการทำเหมืองทองคำในประเทศไทย เป็นถ้ำที่เป็นเหมืองอุโมงค์ มีร่องรอยการทำเหมืองทองคำสมัยก่อนสงครามโลกครั้งที่ 2 อยู่ในป่าดิบกลางหุบเขาที่อุดมสมบูรณ์
219,น้ำตกฉัตรวาริน,5,น้ำตก,โต๊ะเด็ง,สุไหงปาดี,นราธิวาส,ใต้,6.102778,101.834444,ทัศนียภาพสวยงามเป็นแหล่งท่องเที่ยวที่สำคัญ,เป็นน้ำตกขนาดกลาง มีต้นกำเนิดจากยอดเขาบูเต๊ะกาว ในอุทยานแห่งชาติเทือกเขาบูโด-สุไหงปาดี มีน้ำตลอดทั้งปี น้ำตกแบ่งได้ 7 ชั้น ไหลลดหลั่นกันลงมา แวดล้อมไปด้วยพันธุ์ไม้นานาพรรณ บริเวณโดยรอบเป็นป่าดิบชื้น มีไม้หายาก อาทิ หวาย ตะค้าทอง และปาล์มบังสูรย์ ที่พบได้เฉพาะที่นี่
220,น้ำตกบาโจ (ปาโจ),5,น้ำตก,บาเจาะ,บาเจาะ,นราธิวาส,ใต้,6.497778,101.634167,ทัศนียภาพสวยงามเป็นแหล่งท่องเที่ยวที่สำคัญ,เป็นน้ำตกที่เกิดจากโครงสร้างทางธรรมชาติที่ดี เป็นป่าสมบูรณ์และภูเขาสูงที่หายากและสวยงาม โดยน้ำตกซึ่งตกมาจากผาสูงในเทือกเขาบูโด สูง 9 ชั้น ชั้นเเรกสูงประมาณ 70 เมตร ซึ่งมีความสวยงามมาก นับว่าเป็นน้ำตกที่ใหญ่ที่สุดในจังหวัดและสวยงามแห่งหนึ่งของภาคใต้
221,น้ำตกซีโป,5,น้ำตก,เฉลิม,ระแงะ,นราธิวาส,ใต้,6.270278,101.640833,ทัศนียภาพสวยงามเป็นแหล่งท่องเที่ยวที่สำคัญ,เป็นน้ำตกที่เกิดจากโครงสร้างทางธรรมชาติที่ดี จากป่าสมบูรณ์และภูเขาสูงที่หายากและสวยงาม เป็นน้ำตกขนาดใหญ่ ต้นน้ำเกิดจากป่าดิบชื้นธรรมชาติ มี 7 ชั้น ชั้นที่ 7 เป็นชั้นที่สวยงามที่สุด สายน้ำแผ่กว้างสวยงาม อาบเต็มหน้าผาสูงประมาณ 30 เมตร ตกลงสู่แอ่งน้ำเบื้องล่างอย่างสวยงาม
222,หาดนราทัศน์,8,ชายหาด,บางนาค,เมืองนราธิวาส,นราธิวาส,ใต้,6.446111,101.828056,เป็นหาดทรายสีขาวสะอาดทัศนียภาพสวยงาม,เป็นหาดทรายสีขาวละเอียด มีต้นสนขึ้นหนาแน่นตลอดแนวชายหาด พบชุมชนประมงบริเวณชายหาด และชายหาดช่วงที่อยู่ด้านหน้าหมู่บ้านจะมีเรือกอและจอดเรียงรายอย่างสวยงาม โดยเฉพาะลักษณะของเรือกอและที่มีการวาดลวยลายอันวิจิตร ซึ่งเป็นวัฒนธรรมของชาวใต้
223,ถ้ำพระขยางค์,4,ถ้ำ,ลำเลียง,กระบุรี,ระนอง,ใต้,10.326111,98.765278,ทัศนียภาพสวยงามเป็นแหล่งท่องเที่ยวที่สำคัญ,เป็นถ้ำที่มีโครงสร้างทางธรรมชาติที่หายากและสวยงาม เกิดจากภูเขาหินปูน ภายในเเบ่งเป็น 3 ชั้น ปากถ้ำมีพระพุทธรูปอันเป็นที่เคารพสักการะของชาวบ้าน ชั้นบนสุดเป็นที่โล่ง สามารถทะลุออกภายนอกซึ่งเป็นบริเวณที่เชื่อกันว่า มีการนำเอาสมุนไพรที่หายากมาปลูกไว้ ลมพัดเข้าทางช่องอุโมงค์ด้านบนได้
