63,น้ำตกมวกเหล็ก,5,น้ำตก,มิตรภาพ,มวกเหล็ก,สระบุรี,กลาง,14.643333,101.203056,ทัศนียภาพสวยงามเป็นที่พักผ่อนหย่อนใจ,น้ำตกขนาดเล็กที่มีความสวยงาม เป็นน้ำตกชั้นเดียว สูงประมาณ 5 เมตร มีลักษณะเป็นชั้นหินลดหลั่นกันไม่สูงมากนัก ด้านบนของน้ำตกเป็นแอ่งน้ำขนาดใหญ่ ธารน้ำตกไหลตามชั้นหินลงมาสู่งแอ่งน้ำเบื้องล่างอีกชั้นหนึ่ง
64,น้ำตกเจ็ดสาวน้อย,5,น้ำตก,มวกเหล็ก,มวกเหล็ก,สระบุรี,กลาง,14.724381,101.190998,ทัศนียภาพสวยงามเป็นที่พักผ่อนหย่อนใจ,เป็นน้ำตกที่มีความสวยงามมาก เนื่องจากเป็นน้ำตกที่เกิดจากทางน้ำไหลผ่านบ้านเจ็ดสาวน้อย และมี 7 ชั้น แต่ละชั้นมีความสูงตั้งแต่ 2-4 เมตร ความกว้างของน้ำตกประมาณ 20 เมตร ซึ่งระยะทางจากชั้นที่ 1 ถึง ชั้นที่ 7 มีความยาวรวมทั้งสิ้น 490 เมตร ชั้นที่สวยงามที่สุดคือชั้นที่ 4 มีความสูง 4 เมตร
65,บึงพระราม,7,แหล่งน้ำ,ประตูชัย,พระนครศรีอยุธยา,พระนครศรีอยุธยา,กลาง,14.354798,100.5627645,แหล่งท่องเที่ยวสำคัญของจังหวัด,เป็นบึงที่มีความสัมพันธ์กับประวัติสาสตร์และนิทานพื้นบ้าน เป็นบึงขนาดใหญ่กลางเมืองเก่าอยุธยาที่เกิดจากการขุดดินไปถมสร้างวังเเละวัดบริเวณรอบ ๆ ปัจจุบันอยู่ในสวนสาธารณะพระราม
66,ถ้ำธารลอด,4,ถ้ำ,เขาโจด,ศรีสวัสดิ์,กาญจนบุรี,ตะวันตก,14.658056,99.304444,ทัศนียภาพสวยงามเป็นแหล่งท่องเที่ยวที่สำคัญ,เป็นถ้ำขนาดใหญ่ในภูเขาหินปูน ภายในถ้ำมีหินงอกหินย้อยปรากฏเป็นรูปต่าง ๆ มี 2 ถ้ำ คือ ถ้ำธารลอดน้อยและถ้ำธารลอดใหญ่ มีทางเดินศึกษาธรรมชาติถ้ำธารลอดน้อย-ถ้ำธารลอดใหญ่ เป็นเส้นทางลัดเลาะลำธารสลับกับภูเขา ระยะทางประมาณ 2.5 กิโลเมตร
67,ถ้ำพระธาตุ,4,ถ้ำ,ท่ากระดาน,ศรีสวัสดิ์,กาญจนบุรี,ตะวันตก,14.396389,99.081111,ทัศนียภาพสวยงามเป็นแหล่งท่องเที่ยวที่สำคัญและเป็นแหล่งศึกษาทางโบราณคดี,เป็นถ้ำมืดขนาดใหญ่ พื้นถ้ำเรียบ มีความยาวประมาณ 200 เมตร มีหินงอกและหินย้อยรูปร่างสวยงามแปลกตา จุดเด่นของถ้ำพระธาตุ คือ หินส่วนใหญ่จะโปร่งแสง และมีหินทรายรูปร่างคล้ายพระธาตุ นอกจากนี้ยังมีเสาเอก เสาโท อยู่ภายในถ้ำอีกด้วย ภายในถ้ำแบ่งเป็น 5 ห้อง
68,ถ้ำดาวดึงส์,4,ถ้ำ,ไทรโยค,ไทรโยค,กาญจนบุรี,ตะวันตก,14.473161,98.834679,ทัศนียภาพสวยงามเป็นแหล่งท่องเที่ยวที่สำคัญ,เป็นโครงสร้างทางธรรมชาติที่ดี หายาก และมีทัศนียภาพที่สวยงาม ภายในถ้ำมีหินงอกหินย้อย รูปร่างวิจิตรพิสดาร บางลักษณะเป็นคล้ายพระปรางค์ คล้ายเจดีย์ โคมระย้า คล้ายชายสไบ ฯลฯ
69,ถ้ำละว้า,4,ถ้ำ,วังกระแจะ,ไทรโยค,กาญจนบุรี,ตะวันตก,14.299416,98.982244,ทัศนียภาพสวยงามเป็นแหล่งท่องเที่ยวที่สำคัญและเป็นแหล่งศึกษาทางโบราณคดี,เป็นถ้ำขนาดใหญ่ที่มีความสวยงามมาก เป็นโครงสร้างทางธรรมชาติที่ดี และหายาก ภายในถ้ำมีอากาศปลอดโปร่ง มีหินงอกหินย้อยที่มีความวิจิตรตระการตา บ้างเป็นรูปคล้ายพระปรางค์ เจดีย์ มีหลายห้อง
70,น้ำตกเขาพัง (น้ำตกไทรโยคน้อย),5,น้ำตก,ท่าเสา,ไทรโยค,กาญจนบุรี,ตะวันตก,14.238521,99.058321,ทัศนียภาพสวยงามเป็นแหล่งท่องเที่ยวที่สำคัญ,เป็นน้ำตกขนาดเล็ก ที่ยังคงสภาพความเป็นธรรมชาติที่สวยงามร่มรื่น มีน้ำไหลลงมาที่บริเวณหน้าผา ตกลงสู่โขดหินที่ลดหลั่นกันลงมา แล้วจึงไหลเป็นธารน้ำสู่แอ่งน้ำเบื่องล่าง ด้านบนของน้ำตกมีการค้นพบถ้ำสวรรค์-วังบาดาล ซึ่งเป็นถ้ำขนาดเล็ก มีความสวยงามมาก
71,น้ำตกไทรโยคใหญ่,5,น้ำตก,ไทรโยค,ไทรโยค,กาญจนบุรี,ตะวันตก,14.436906,98.851137,ทัศนียภาพสวยงามเป็นแหล่งท่องเที่ยวที่สำคัญ,เป็นน้ำตกขนาดเล็ก มีอีกชื่อหนึ่งว่า น้ำตกเขาโจน เพราะน้ำที่ตกลงมาจากหน้าผาสู่แม่น้ำแควน้อยแรงมากราวกับกระโจนลงมา น้ำตกไทรใหญ่จะมีน้ำตลอดปี แต่น้ำจะแรงมากในฤดูฝน ความเด่นของน้ำตก คือ ที่ด้านหน้าของน้ำตกอยู่บนลำน้ำแคว
72,น้ำตกห้วยแม่ขมิ้น,5,น้ำตก,แม่กระบุง,ศรีสวัสดิ์,กาญจนบุรี,ตะวันตก,14.6375,98.9875,ทัศนียภาพสวยงามเป็นแหล่งท่องเที่ยวที่สำคัญ,เกิดจากลำห้วยแม่ขมิ้นที่ไหลผ่านเทือกเขาหินปูนลดหลั่นลงมาเป็นชั้น ๆ ก่อให้เกิดน้ำตกที่สวยงามทั้งหมด 7 ชั้น ไหลลงมาจากเขื่อนศรีนครินทร์ ความงามของม่านน้ำตกที่ไหลลดหลั่นกันลงมาเป็นชั้นเล็กชั้นน้อย มีความสวยงามมาก
73,น้ำตกเอราวัณ (เขาสลอบ),5,น้ำตก,ท่ากระดาน,ศรีสวัสดิ์,กาญจนบุรี,ตะวันตก,14.368333,99.143889,ทัศนียภาพสวยงามเป็นแหล่งท่องเที่ยวที่สำคัญ,"เป็นน้ำตกขนาดใหญ่ที่มีความสวยงามมาก มีความยาวประมาณ 2 กิโลเมตร มีทั้งหมด 7 ชั้น ธารน้ำตกไหลลงมาตามชั้นหินที่เป็นตะกอนหินปูนเกิดเป็นชั้น ๆ กลมมนคล้ายหัวช้างสามเศียรหรือที่เรียกว่า ""ช้างเอราวัณ"" จึงเป็นที่มาของ ""อุทยานแห่งชาติเอราวัณ"""
74,สวนหิน (กาญจนบุรี),10,ธรณีสัณฐานและภูมิลักษณวรรณา,ทุ่งนาคราช,เมืองกาญจนบุรี,กาญจนบุรี,ตะวันตก,13.989834,99.453941,ทัศนียภาพสวยงามเป็นแหล่งท่องเที่ยวที่สำคัญ,สวนหินหรือลานหินผุดมีลักษณะเป็นโขดหินปูนเตี้ย ๆ มีรูปร่างและขนาดต่าง ๆ กัน กระจายอยู่ตามที่ราบระหว่างเขาและที่ลาดเนินเขา ที่ระดับความสูง 55-60 เมตร เหนือระดับน้ำทะเลปานกลาง
75,เขางู,3,ภูเขา,เกาะพลับพลา,เมืองราชบุรี,ราชบุรี,ตะวันตก,13.568889,99.774722,เป็นเอกลักษณ์ของท้องถิ่นและเป็นสถานที่ศักดิ์สิทธิ์,เป็นภูเขาหินปูนอยู่ในอำเภอเมือง จังหวัดราชบุรี เคยเป็นแหล่งระเบิดหินปูน ต่อมาจึงได้พัฒนาเป็นสวนสาธารณะเขางู มีทัศนียภาพที่งดงาม เทือกเขาต่าง ๆ มีความลดหลั่นกันคล้ายงูเลื้อย อีกทั้งยังเป็นแหล่งโบราณคดีที่หาได้ยาก
76,ถ้ำเขาบิน,4,ถ้ำ,หินกอง,เมืองราชบุรี,ราชบุรี,ตะวันตก,13.592777,99.665897,เป็นเอกลักษณ์ของท้องถิ่น,เป็นถ้ำที่มีโครงสร้างทางธรรมชาติที่ดี หายาก ภายในถ้ำเต็มไปด้วยหินงอกหินย้อยที่มีความสวยงาม
77,ถ้ำจอมพล,4,ถ้ำ,จอมบึง,จอมบึง,ราชบุรี,ตะวันตก,13.626724,99.589069,ทัศนียภาพสวยงามเป็นแหล่งท่องเที่ยวที่สำคัญและเป็นสถานที่ศักดิ์สิทธิ์,เป็นถ้ำที่มีหินงอกหินย้อยภายในที่มีความงดงามแปลกตา ลักษณะของหินงอกหินย้อยจะคล้ายม่านน้ำตกขนาดใหญ่ หรือเครื่องประดับยศจอมพล
78,เขาเจ้าลาย,3,ภูเขา,เขาใหญ่,ชะอำ,เพชรบุรี,ตะวันตก,12.835742,99.95141,ทัศนียภาพสวยงามเป็นแหล่งท่องเที่ยวที่สำคัญและเป็นเอกลักษณ์ของท้องถิ่น,ป็นภูเขาที่เป็นประติมากรรมทางธรรมชาติ มีลักษณะสวยงามและเป็นเอกลักษณ์ ทอดยาวตามแนวเหนือ-ใต้ มองดูคล้ายนางยักษ์ (นางพันธุรัต) นอนอยู่ มีโกศอยู่ทางทิศใต้ บนเขามีถ้ำและสามารถมองเห็นทิวทัศน์สวยงาม
79,เขาวัง (เพชรบุรี),3,ภูเขา,คลองกระแซง,เมืองเพชรบุรี,เพชรบุรี,ตะวันตก,13.10915735,99.93657048,เป็นเอกลักษณ์ของท้องถิ่น,เป็นภูเขาหินปูนขนาดย่อมสูงประมาณ 92 เมตร รัชกาลที่ 4 ทรงสร้างพระราชวังสำหรับแปรพระราชฐานขึ้นบนเขาวัง ซึ่งเขาวังนี้ประกอบด้วยยอดเขาใหญ่ ๆ 3 ยอดด้วยกัน คือ ยอดเขาด้านทิศตะวันออก เขายอดกลาง และยอดเขาด้านทิศตะวันตก
80,ถ้ำเขาหลวง,4,ถ้ำ,ธงชัย,เมืองเพชรบุรี,เพชรบุรี,ตะวันตก,13.13519,99.932943,เป็นที่ประดิษฐานพระพุทธรูปปางมารวิชัยที่รัชกาลที่ 5 สร้างเป็นพระราชกุศลแด่ราชวงศ์จักรี,เป็นถ้ำที่เกี่ยวกับประวัติศาสตร์และเป็นที่ประดิษฐานพระพุทธรูปปรางมารวิชัย ซึ่งรัชกาลที่ 5 ทรงสร้างถวายเป็นพระราชกุศลแก่ราชวงศ์จักรี
81,หาดเจ้าสำราญ,8,ชายหาด,เจ้าสำราญ,เมืองเพชรบุรี,เพชรบุรี,ตะวันตก,13.005589,100.065123,ทัศนียภาพสวยงามเป็นแหล่งท่องเที่ยวที่สำคัญและเกี่ยวข้องทางประวัติศาสตร์,เป็นหาดที่มีโครงสร้างทางธรรมชาติที่ดี มีทัศนียภาพที่สวยงาม และเกี่ยวข้องกับประวัติศาสตร์ เป็นหาดทรายยาวตามแนวชายฝั่ง และมีจุดชมวิวที่สามารถมองเห็นได้ชัดเจน
82,หาดชะอำ,8,ชายหาด,ชะอำ,ชะอำ,เพชรบุรี,ตะวันตก,12.7945,99.984086,ทัศนียภาพสวยงามเป็นแหล่งท่องเที่ยวที่สำคัญ,เป็นหาดที่มีโครงสร้างตามธรรมชาติที่สวยงาม เดิมเป็นสถานที่พักผ่อนของเจ้านายชั้นผู้ใหญ่ในสมัยก่อน ปัจจุบันเป็นสถานที่ท่องเที่ยวตากอากาศที่มีชื่อเสียงแห่งหนึ่งของจังหวัดเพชรบุรี
83,น้ำตกห้วยยาง,5,น้ำตก,ห้วยยาง,ทับสะแก,ประจวบคีรีขันธ์,ตะวันตก,11.625278,99.613889,ทัศนียภาพสวยงามเป็นแหล่งท่องเที่ยวที่สำคัญ,เป็นโครงสร้างทางธรรมชาติที่ดี หายาก และทัศนียภาพที่สวยงาม น้ำตกมี 5 ชั้น สภาพพื้นที่บริเวณน้ำตกชุ่มชื่นสวยงาม มีโขดหินขนาดใหญ่มากมาย รวมทั้งชั้นหินที่มีลักษณะเป็นแอ่งน้ำ ซึ่งมีธารน้ำไหลลงสู่เบื้องล่างอีกชั้นหนึ่ง
84,หาดวนกร,8,ชายหาด,ห้วยยาง,ทับสะแก,ประจวบคีรีขันธ์,ตะวันตก,11.636159,99.703499,ทัศนียภาพสวยงามเป็นแหล่งท่องเที่ยวที่สำคัญ,เป็นพื้นที่ที่มีโครงสร้างทางธรรมชาติที่ดี หายาก และมีทัศนียภาพที่สวยงาม เป็นหาดทรายที่มีทรายละเอียดขาวสะอาด ทอดตัวเป็นแนวยาวสลับกับหัวกรังที่ยื่นลงไปในทะเลเป็นตอน ๆ
85,หาดหัวหิน (ประจวบคีรีขันธ์),8,ชายหาด,หัวหิน,หัวหิน,ประจวบคีรีขันธ์,ตะวันตก,12.569722,99.961389,มีโครงสร้างทางธรรมชาติที่ดี ทัศนียภาพสวยงามเป็นแหล่งท่องเที่ยวที่สำคัญ,หาดหัวหินนั้นนับว่าเป็นโครงสร้างทางธรรมชาติที่ดี หายาก และมีทัศนียภาพที่สวยงาม เป็นชายหาดที่มีหาดทรายขาวละเอียด เป็นแหล่งท่องเที่ยวพักตากอากาศที่มีชื่อเสียงแห่งแรกของเมืองไทย และเป็นสถานที่พักตากอากาศที่มีชื่อเสียงระดับโลก
86,เขาเต่า,3,ภูเขา,หนองแก,หัวหิน,ประจวบคีรีขันธ์,ตะวันตก,12.455278,99.978611,ทัศนียภาพสวยงามเป็นแหล่งท่องเที่ยวที่สำคัญ,ลักษณะของเขาเต่าเป็นโครงสร้างทางธรรมชาติที่ดี หายาก และมีทัศนียภาพที่สวยงาม เป็นภูเขาหินปูนที่สวยงาม สามารถมองเห็นวิวได้ 360 องศา
87,ดอนหอยหลอด,8,ชายหาด,บางจะเกร็ง,เมืองสมุทรสงคราม,สมุทรสงคราม,กลาง,13.361792,100.023104,แหล่งท่องเที่ยวสำคัญของจังหวัด,เป็นสถานที่ที่มีความเป็นเอกลักษณ์หรือสัญลักษณ์ท้องถิ่นของเมืองสมุทรสงคราม และมีลักษณะเด่นที่หาพบได้ยากในประเทศไทย เพราะเป็นที่อยู่อาศัยของหอยหลายชนิด โดยเฉพาะหอยหลอด ซึ่งจัดว่าเป็นพื้นที่ที่พบหอยหลอดได้มากที่สุดในบริเวณชายฝั่งอ่าวไทยทั้งหมด
88,น้ำตกนางรอง,5,น้ำตก,หินตั้ง,เมืองนครนายก,นครนายก,กลาง,14.327778,101.318889,ทัศนียภาพสวยงามเป็นแหล่งท่องเที่ยวที่สำคัญ,เป็นน้ำตกขนาดกลางไหลลงมาตามโขดหินขนาดใหญ่ ลดหลั่นกันเป็นชั้น ๆ เป็นทางยาวประมาณ 100 เมตร สภาพแวดล้อมรอบข้างบริเวณร่มรื่นมีต้นน้ำอยู่ในเขตอุทยานแห่งชาติเขาใหญ่
89,น้ำตกสาริกา,5,น้ำตก,สาริกา,เมืองนครนายก,นครนายก,กลาง,14.308333,101.255,ทัศนียภาพสวยงามเป็นแหล่งท่องเที่ยวที่สำคัญ,เป็นน้ำตกขนาดใหญ่ สายน้ำไหลตกจากหน้าผาสูงชันเป็นทอด ๆ ถึง 9 ชั้น ผาที่สูงที่สุดประมาณ 100 เมตร แต่ละชั้นมีอ่างรับน้ำขนาดย่อม เหมาะแก่การลงเล่นน้ำ แต่ในฤดูฝนจะมีปริมาณน้ำมาก
90,แก่งสลัดได,2,แก่ง,บุฝ้าย,ประจันตคาม,ปราจีนบุรี,ตะวันออก,14.185278,101.593889,เป็นแหล่งต้นน้ำลำธารจากอุทยานแห่งชาติเขาใหญ่และเป็นแหล่งศึกษาด้านวิทยาศาสตร์และภูมิศาสตร์,เป็นน้ำตกที่มีลักษณะเป็นแก่งน้ำกว้าง มีสะพานแขวนทอดข้ามน้ำตกตะคร้อ สภาพเป็นแก่งน้ำไหลตามหุบเขาเทือกเขาใหญ่ มีน้ำไหลเชี่ยวเฉพาะหน้าฝน ไหลลดระดับตามแก่งหิน สองฝากมีเนินเขา และมีป่าโปร่งเหมาะแก่การเดินเล่นและพักผ่อน
91,น้ำตกเขาอีโต้,5,น้ำตก,บ้านพระ,เมืองปราจีนบุรี,ปราจีนบุรี,ตะวันออก,14.15151,101.409502,เป็นเอกลักษณ์ของท้องถิ่น,เป็นลำธารขนาดใหญ่ ที่มีเอกลักษณ์ของท้องถิ่น
92,น้ำตกห้วยเกษียร,5,น้ำตก,ดงขี้เหล็ก,เมืองปราจีนบุรี,ปราจีนบุรี,ตะวันออก,14.165276,101.447938,เป็นเอกลักษณ์ของท้องถิ่น,เป็น้ำตกที่อยู่บริเวณที่ราบเชิงเขา ระหว่างเขาชีปิด และเทือกเขาอีกแนวหนึ่ง ทำให้พื้นที่มีลักษณะเป็นแอ่งเว้า มีชั้นเดียวสูงประมาณ 2 เมตร
