ลำดับที่,ชื่อแหล่งธรรมชาติ,ประเภทที่,ประเภทแหล่ง,ตำบล,อำเภอ,จังหวัด,ภาค,ละติจูด,ลองจิจูด,ความสำคัญ,ลักษณะของพื้นที่
1,ทุ่งบัวตอง (ดอยแม่อูคอ),3,ภูเขา,แม่อูคอ,ขุนยวม,แม่ฮ่องสอน,เหนือ,18.894721,98.091094,แหล่งท่องเที่ยวสำคัญของจังหวัด,"ทุ่งบัวตอง ดอยแม่อูคอ มีลักษณะของภูเขาสลับซับซ้อนคล้ายคลื่นทะเล มีจุดเด่นที่น่าสนใจ คือ ในทุกช่วงฤดูหนาวประมาณกลางเดือนพฤศจิกายน - เดือนธันวาคม จะมีดอกบัวตองซึ่งเป็นดอกไม้สีเหลืองนับล้าน ชูช่อบานสะพรั่งเต็มพื้นที่ภูเขา กว่า 1,000 ไร่ บนความสูงประมาณ 1,600 เมตรจากระดับน้ำทะเล"
2,ดอยกองมู,3,ภูเขา,จองคำ,เมืองแม่ฮ่องสอน,แม่ฮ่องสอน,เหนือ,19.300055,97.960567,เป็นที่ประดิษฐานพระธาตุดอยกองมู,ดอยกองมู เป็นดอยที่สามารถมองเห็นทัศนียภาพของเมืองจากมุมสูงได้อย่างสวยงาม เป็นที่ประดิษฐานพระธาตุดอยกองมู และยังเป็นที่ตั้งของวัดพระธาตุดอยกองมูซึ่งประดิษฐานพระธาตุอันเป็นปูชนียสถานคู่บ้านคู่เมืองของจังหวัดแม่ฮ่องสอน
3,ถ้ำน้ำลอด,4,ถ้ำ,ถ้ำลอด,ปางมะผ้า,แม่ฮ่องสอน,เหนือ,19.568056,98.279722,เป็นแหล่งสำคัญทางประวัติศาสตร์และโบราณคดี,ถ้ำน้ำลอด เป็นถ้ำที่มีขนาดใหญ่ กว้างประมาณ 20 เมตร สูงประมาณ 50 เมตร ยาวประมาณ 1 กิโลเมตร ภายในถ้ำมีน้ำจากลำห้วย “น้ำลาง” ไหลผ่านตลอดเป็นทางกว้างลอดภูเขาไปทะลุออกกีกด้านหนึ่ง จึงเรียกว่า “ถ้ำน้ำลอด” ภายในถ้ำพบหินงอกหินย้อยสวยงาม
4,น้ำตกผาเสื่อ,5,น้ำตก,ห้วยผา,เมืองแม่ฮ่องสอน,แม่ฮ่องสอน,เหนือ,19.490904,97.957871,แหล่งท่องเที่ยวภายในท้องถิ่น,น้ำตกที่เกิดจากลำน้ำแม่สะงาในพม่าไหลผ่านโขดหินใหญ่ มี 6 ชั้น สองข้างน้ำตกมีแผ่นหินลักษณะคล้ายเสื่อปูลาดอยู่เป็นจำนวนมาก บริเวณโดยรอบน้ำตกเป็นป่าทึบที่มีความชุ่มชื้น
5,ถ้ำปลา,4,ถ้ำ,ห้วยผา,เมืองแม่ฮ่องสอน,แม่ฮ่องสอน,เหนือ,19.426681,97.990252,แหล่งท่องเที่ยวสำคัญของจังหวัด,เป็นถ้ำที่ตั้งอยู่บริเวณเชิงเขาหินปูน มีลักษณะเป็นแอ่งน้ำขนาดใหญ่ สภาพดีและสวยงาม  ภายในแอ่งน้ำมีน้ำไหลเวียนออกจากโพรงภูเขาอยู่ตลอดเวลา และมีปลาอาศัยเป็นจำนวนมาก เรียกว่า ปลามุง หรือ ปลาคัง หรือปลาพลวง
6,น้ำตกแม่สุรินทร์,5,น้ำตก,แม่อูคอ,ขุนยวม,แม่ฮ่องสอน,เหนือ,18.942222,98.071111,เป็นน้ำตกที่สูงที่สุดในภาคเหนือ,น้ำตกชั้นเดียวที่ใหญ่และสวยงามมาก ลักษณะของสายน้ำจะไหลจาก หน้าผาสูงดิ่งลงสู่หุบเบื้องล่าง ประมาณ 200-300 เมตร น้ำตกอยู่ระหว่างหุบเขา
7,ถ้ำเชียงดาว,4,ถ้ำ,เชียงดาว,เชียงดาว,เชียงใหม่,เหนือ,19.394675,98.928988,แหล่งท่องเที่ยวสำคัญของ อ.เชียงดาว,"เป็นถ้ำขนาดใหญ่บนดอยหลวงเชียงดาว ยอดเขาสูงประมาณ 2,180 เมตร เป็นสัญลักษณ์ประจำท้องถิ่นของอำเภอเชียงดาว ภายในถ้ำเชียงดาว มีหินงอกหินย้อยขนาดใหญ่และสวยงาม เป็นจำนวนมาก แต่มีสีขุ่นเนื่องจากเป็นหินปูนเนื้อโคลน"
8,ถ้ำเมืองออน,4,ถ้ำ,บ้านสหกรณ์,แม่ออน,เชียงใหม่,เหนือ,18.796273,99.234862,แหล่งท่องเที่ยวสำคัญของจังหวัด,เป็นพุทธสถานที่สำคัญของชาวไทยและชาวไทยล้านนา และสถานที่ท่องเที่ยวที่สำคัญของจังหวัดเชียงใหม่
9,น้ำตกห้วยแก้ว,5,น้ำตก,ช้างเผือก สุเทพ,เมืองเชียงใหม่,เชียงใหม่,เหนือ,18.811776,98.944537,แหล่งท่องเที่ยวสำคัญของจังหวัด,น้ำตกห้วยแก้วเป็นน้ำตกเล็ก ๆ สูงประมาณ 10 เมตร ตั้งอยู่ในเขตอุทยานแห่งชาติดอยสุเทพ-ปุย เป็นสถานที่ที่ยังคงความเป็นธรรมชาติที่สมบูรณ์ท่ามกลางเมืองใหญ่
10,น้ำตกแม่ยะ,5,น้ำตก,บ้านหลวง,จอมทอง,เชียงใหม่,เหนือ,18.439936,98.598006,แหล่งท่องเที่ยวสำคัญของจังหวัด,เป็นน้ำตกขนาดใหญ่และสูงที่สุดในบรรดาน้ำตกในอุทยานแห่งชาติดอยอินทนนท์ น้ำตกจากหน้าผาสูงชันไหลลงมา มีประมาณ 30 ชั้น รวมความสูงประมาณ 280 เมตร ในช่วงฤดูฝน สายน้ำตกจะแผ่กว้างถึง 100 เมตร เหมือนกับม่านน้ำ แล้วไหลลงไปรวมกันที่แอ่งน้ำเบื้องล่าง และบางช่วงของหน้าผาเป็นชะง่อนหิน
11,น้ำตกแม่กลาง,5,น้ำตก,บ้านหลวง,จอมทอง,เชียงใหม่,เหนือ,18.495278,98.667222,ทัศนียภาพสวยงามเป็นที่พักผ่อนหย่อนใจ,เป็นน้ำตกขนาดใหญ่ที่มีแอ่งน้ำขนาดใหญ่ให้ลงเล่นน้ำหลายแห่ง มีความสวยงามตามธรรมชาติ รอบ ๆ บริเวณร่มรื่นน่าพักผ่อน แต่ในช่วงฤดูฝนกระแสน้ำไหลแรงอาจเป็นอัตรายต่อการเล่นน้ำได้
12,น้ำตกแม่สา,5,น้ำตก,แม่แรม,แม่ริม,เชียงใหม่,เหนือ,18.906536,98.897165,แหล่งท่องเที่ยวสำคัญของจังหวัด,เป็นน้ำตกขนาดใหญ่ แบ่งชั้นไปตามเชิงเขาถึง 10 ชั้น ปกคลุมด้วยต้นไม้ใหญ่ทั่วบริเวณ ทำให้สภาพอากาศร่มรื่นเย็นสบายตลอดปี
13,โป่งเดือดป่าแป๋,6,โป่งน้ำพุร้อน,ป่าแป๋,แม่แตง,เชียงใหม่,เหนือ,19.241667,98.684167,แหล่งท่องเที่ยวธรรมชาติศึกษาวิทยาที่สำคัญ,เป็นน้ำพุร้อนที่ใหญ่และสูงที่สุดในประเทศไทย และเป็นแหล่งท่องเที่ยวศึกษาธรรมชาติธรณีที่สำคัญแห่งหนึ่ง
14,บ่อน้ำร้อนฝาง,6,โป่งน้ำพุร้อน,โป่งน้ำร้อน,ฝาง,เชียงใหม่,เหนือ,19.965566,99.154174,แหล่งพลังงานในโครงการพลังงานความร้อนใต้พิภพฝาง (ระยะที่ 1),เป็นแหล่งพลังงานในโครงการพลังงานความร้อนใต้พิภพฝาง (ระยะที่ 1) เเละเป็นแหล่งท่องเที่ยวศึกษาธรณีวิทยา
15,ออบหลวง,10,ธรณีสัณฐานและภูมิลักษณวรรณา,หางดง,ฮอด,เชียงใหม่,เหนือ,18.245278,98.520278,ทัศนียภาพสวยงามเป็นที่พักผ่อนหย่อนใจ,มีลักษณะเป็นช่องแคบเขาขาด ที่มีหน้าผาหินขนาบสองข้างของลําน้ำ หน้าผาวัดจากสะพานถึงระดับน้ำประมาณ 32 เมตร ส่วนแคบสุดของช่องแคบหน้าผาทั้งสองเพียง 2 เมตร ความยาวของช่องแคบประมาณ 300 เมตร บริเวณใกล้เคียงออบหลวงมีการขุดค้นพบหลักฐานทางโบราณคดี สมัยก่อนประวัติศาสตร์จํานวนมาก เช่น เครื่องมือหิน เครื่องสําริด เครื่องปั้นดินเผา โครงกระดูกมนุษย์ เป็นต้น
16,ผาจ้อ (ผาช่อ),10,ธรณีสัณฐานและภูมิลักษณวรรณา,สันติสุข,ดอยหล่อ,เชียงใหม่,เหนือ,18.517615,98.737068,แหล่งศึกษาทางธรณีวิทยา,มีลักษณะเป็นหน้าผา สูงประมาณ 30 เมตร เป็นหน้าดินลูกรังซึ่งถูกน้ำชะล้างทำให้เกิดเป็นร่อง มีลักษณะธรณีสัณฐานที่แปลกตา
17,ถ้ำหลวง-ขุนน้ำนางนอน (เขานางนอน),4,ถ้ำ,โป่งผา,แม่สาย,เชียงราย,เหนือ,20.38162,99.867115,ทัศนียภาพสวยงามเป็นแหล่งท่องเที่ยวที่สำคัญ,เป็นถ้ำหินปูนขนาดใหญ่ ปากถ้ำเป็นห้องโถงกว้างมากภายในถ้ำจะพบกับความงามของ เกล็ดหินสะท้อนแสง หินงอก หินย้อย ธารน้ำและถ้ำลอด
18,น้ำตกขุนกรณ์,5,น้ำตก,แม่กรณ์,เมืองเชียงราย,เชียงราย,เหนือ,19.876583,99.625222,เป็นน้ำตกที่สูงที่สุดของ จ.เชียงราย,"น้ำตกแห่งนี้มีน้ำไหลตลอดปีและเป็นน้ำใสที่ไม่มีตะกอน ตัวน้ำตกสูงถึง 70 เมตร โดยมีลักษณะเป็นหน้าผาชัน เดิมชาวบ้านเรียก ""น้ำตกตาดหมอก"" ซึ่งคำว่า ""ตาด"" เป็นภาษาลาว แปลว่าน้ำตก"
19,น้ำตกปูแกง,5,น้ำตก,แม่เย็น,พาน,เชียงราย,เหนือ,19.441542,99.699073,แหล่งท่องเที่ยวและแหล่งธรรมชาติศึกษา,เป็นน้ำตกขนาดใหญ่ที่สุดในจังหวัดเชียงราย ใต้ดินมีตะกอนหินปูนปนมากับน้ำ ทำให้เกิดหินงอกหินย้อยและถ้ำตื้น ๆ สวยงามแปลกตา มีโขดหินที่เป็นลักษณะเพิงผาที่แปลกตา เป็นน้ำตกที่ไหลจากภูเขาสูงสลับซับซ้อน เกิดเป็นชั้นน้ำตกถึง 9 ชั้น มีน้ำไหลในปริมาณสม่ำเสมอตลอดปี
20,หาดทรายริมแม่น้ำกก (พัทยา 2),8,ชายหาด,รอบเวียง,เมืองเชียงราย,เชียงราย,เหนือ,19.917778,99.797222,ทัศนียภาพสวยงามเป็นแหล่งท่องเที่ยวที่สำคัญ,เป็นสถานที่ท่องเที่ยวเเละมีทัศนียภาพที่สวยงาม
21,น้ำตกภูซาง,5,น้ำตก,ภูซาง,ภูซาง,พะเยา,เหนือ,19.663686,100.376895,ทัศนียภาพสวยงามเป็นแหล่งท่องเที่ยวที่สำคัญ,เป็นน้ำตกหินปูนชั้นเดียวขนาดเล็กมีน้ำไหลสม่ำเสมอตลอดปี สูงประมาณ 25 เมตร จุดเด่นของน้ำตกภูซางอยู่ตรงที่เป็นกระแสน้ำอุ่น อุณหภูมิประมาณ 35 องศาเซลเซียส น้ำใส ไม่มีกลิ่นของกำมะถัน
22,น้ำตกจำปาทอง,5,น้ำตก,บ้านต๊ำ,เมืองพะเยา,พะเยา,เหนือ,19.2175,99.737778,ทัศนียภาพสวยงามเป็นแหล่งท่องเที่ยวที่สำคัญและแหล่งศึกษาธรรมชาติ,น้ำตกจำปาทองมีต้นน้ำมาจากดอยหลวง เป็นน้ำตก 6 ชั้น ความสูงแต่ละชั้นประมาณ 20 เมตร ลักษณะสูงชัน น้ำใสสะอาดไหลสม่ำเสมอตลอดปี น้ำไหลจากโขดหินขนาดใหญ่ลงมาสู่เบื้องล่าง มีแอ่งน้ำให้ลงเล่นน้ำหลายแห่ง
23,กว๊านพะเยา,7,แหล่งน้ำ,บ้านสาง,เมืองพะเยา,พะเยา,เหนือ,19.166389,99.866667,แหล่งน้ำธรรมชาติที่สำคัญที่สุดของจังหวัด,เป็นสัญลักษณ์ของท้องถิ่นและเป็นแหล่งน้ำธรรมชาติที่สำคัญที่สุดของจังหวัด
24,ฝั่งต้า,10,ธรณีสัณฐานและภูมิลักษณวรรณา,เชียงม่วน,เชียงม่วน,พะเยา,เหนือ,18.871667,100.312222,ทัศนียภาพสวยงามเป็นแหล่งท่องเที่ยวที่สำคัญ,เป็นหน้าผาดินสูงชันประมาณ 100 เมตร ที่เกิดจากน้ำกัดเซาะของน้ำ เป็นโครงสร้างทางธรรมชาติที่ดี หายาก
25,ถ้ำหลวงผาเวียง,4,ถ้ำ,ป่าพลู,บ้านโฮ่ง,ลำพูน,เหนือ,18.221667,98.858056,ทัศนียภาพสวยงามเป็นแหล่งท่องเที่ยวที่สำคัญ,เป็นเอกลักษณ์หรือสัญลักษณ์ท้องถิ่น และเป็นโครงสร้างทางธรรมชาติที่ดี หายาก และยังคงความเป็นธรรมชาติ
26,น้ำตกแม่ก้อ (ก้อหลวง),5,น้ำตก,ก้อ,ลี้,ลำพูน,เหนือ,17.58357,98.817549,ทัศนียภาพสวยงามเป็นแหล่งท่องเที่ยวที่สำคัญ,เป็นน้ำตกหินปูนที่ไหลมาจากลำน้ำในห้วยแม่ก้อ ดอยก้อหลวง ไหลผ่านหินดินดานเทาดำ และหินทรายของหน้าผาที่สูงต่างระดับลดหลั่นกันทั้งหมด 7 ชั้น มีน้ำไหลตลอดปี เป็นน้ำตกที่มีหินงอกหินย้อยสวยงามตาม ธรรมชาติ มีแอ่งน้ำขนาดใหญ่สีเขียวมรกต
27,ถ้ำผาไท,4,ถ้ำ,บ้านหวด,งาว,ลำปาง,เหนือ,18.6052,99.8973,ทัศนียภาพสวยงามเป็นแหล่งท่องเที่ยวที่สำคัญและแหล่งศึกษาธรรมชาติ,เป็นถ้ำกึ่งแห้งมีการเกิดของหินงอกและหินย้อยอยู่น้อยมาก แต่ภายในถ้ำมีความงดงาม หน้าถ้ำเป็นห้องโถงกว้างมีหินย้อยขนาดใหญ่ ด้านขวามีพระปรมาภิไธยย่อ ปปร. ของพระบาทสมเด็จพระปกเกล้าเจ้าอยู่หัว จารึกไว้เมื่อครั้งเสด็จประพาสถ้ำ พ.ศ. 2469 มีลักษณะภูมิประเทศแบบหินปูน (Karst topography) โถงถ้ำมีโถงเดียว มีความยาว รวม 414.54 เมตร วางตัวในทิศทางตะวันตกเฉียงใต้-ตะวันออกเฉียงเหนือ (SW-NE)
28,น้ำตกวังแก้ว,5,น้ำตก,วังแก้ว,วังเหนือ,ลำปาง,เหนือ,19.318333,99.660833,ทัศนียภาพสวยงามเป็นแหล่งท่องเที่ยวที่สำคัญ,เป็นน้ำตก 11 ชั้น เกิดจากการทับถมของหินปูนที่ละลายปนมากับน้ำ ชั้นบนมีถ้ำขนาดใหญ่มีหมู่บ้านชาวเขาเผ่าเย้า และสามารถมองเห็นกว๊านพะเยาได้ด้วย
29,น้ำตกแจ้ช้อน-น้ำพุร้อนแจซ้อน,6,โป่งน้ำพุร้อน,แจ้ซ้อน,เมืองปาน,ลำปาง,เหนือ,18.836944,99.471667,ทัศนียภาพสวยงามเป็นแหล่งท่องเที่ยวที่สำคัญ,เป็นน้ำตกที่เกิดจากการไหลของน้ำจากลำห้วยแม่มอญ ไหลผ่านภูมิประเทศที่มีระดับความสูงแตกต่างกันกลายเป็นน้ำตกแจ้ซ้อนที่มีความสวยงาม ประกอบด้วยชั้นน้ำตกจำนวน 6 ชั้น มีน้ำไหลตลอดปี มีแอ่งน้ำรองรับตลอดสาย และน้ำพุร้อนแจ้ซ้อนเป็นน้ำพุร้อนที่มีโครงสร้างทางธรรมชาติที่สวยงาม มีบ่อน้ำร้อน 9 บ่อ ซึ่งมีอุณหภูมิระหว่าง 75-80 องศาเซลเซียส มีธารน้ำร้อนเเละน้ำเย็นไหลมาพบกัน
30,แก่งหลวง,2,แก่ง,บ้านปิน,ลอง,แพร่,เหนือ,18.032778,99.886389,ทัศนียภาพสวยงามเป็นแหล่งท่องเที่ยวที่สำคัญ,เป็นแก่งตามธรรมชาติ เกิดจากกระแสแม่น้ำน่านไหลผ่านโขดหินที่กระจายอยู่กลางแม่น้ำ ในหน้าน้ำจะได้ยินเสียงน้ำกระทบโขดหินดังกึกก้อง ยามหน้าแล้งจะมองเห็นแนวโขดหิน และหาดทรายสีขาวเป็นแนวยาวตามริมฝั่งแม่น้ำน่าน
31,ถ้ำผานางคอย,4,ถ้ำ,ร้องกวาง,ร้องกวาง,แพร่,เหนือ,18.369162,100.351554,เป็นสถานที่ศักดิ์สิทธิ์ของชาวบ้าน,มีความสัมพันธ์เกี่ยวกับนิทานพื้นบ้าน และเป็นสถานที่ศักดิ์สิทธิ์ของชาวบ้าน
32,น้ำตกห้วยโรง,5,น้ำตก,ห้วยโรง,ร้องกวาง,แพร่,เหนือ,18.441922,100.450282,ทัศนียภาพสวยงามเป็นแหล่งท่องเที่ยวที่สำคัญ,เป็นน้ำตกขนาดเล็ก มีชั้นน้ำตก 2 ชั้น สูงประมาณ 15 เมตร สายน้ำตก ลงมาบนโขดหิน มีแอ่งน้ำรองรับ สภาพโดยรอบเป็นสวนรุกขชาติห้วยโรง
